<!DOCTYPE bill SYSTEM "bill.dtd">

<bill>
	<customername>Arun</customername>
	<billno>100</billno>
	<billdate>08-03-2021</billdate>
	<items>
		<item>
			<slno>1</slno>
			<itemname>Daal</itemname>
			<unit>1</unit>
			<price>120</price>
			<qty>5</qty>
			<amount>600</amount>
		</item>
	
		<item>
			<slno>2</slno>
			<itemname>Rice</itemname>
			<unit>1</unit>
			<price>60</price>
			<qty>5</qty>
			<amount>300</amount>
		</item>
	</items>
	<total>2500</total>
</bill>